root@lamp-s-1vcpu-1gb-tor1-01:~# tcpdump -n -i eth0
tcpdump: verbose output suppressed, use -v or -vv for full protocol decode
listening on eth0, link-type EN10MB (Ethernet), capture size 262144 bytes
04:42:55.341964 IP 159.203.47.142.22 > 173.206.219.44.54505: Flags [P.], seq 1472616058:1472616166, ack 2641395215, win 319, length 108
04:42:55.342153 IP 159.203.47.142.22 > 173.206.219.44.54505: Flags [P.], seq 108:144, ack 1, win 319, length 36
04:42:55.342274 IP 159.203.47.142.22 > 173.206.219.44.54505: Flags [P.], seq 144:252, ack 1, win 319, length 108
04:42:55.342370 IP 159.203.47.142.22 > 173.206.219.44.54505: Flags [P.], seq 252:288, ack 1, win 319, length 36
04:42:55.342611 IP 159.203.47.142.22 > 173.206.219.44.54505: Flags [P.], seq 288:460, ack 1, win 319, length 172
04:42:55.343254 IP 159.203.47.142.22 > 173.206.219.44.54505: Flags [P.], seq 460:496, ack 1, win 319, length 36
04:42:55.343404 IP 159.203.47.142.22 > 173.206.219.44.54505: Flags [P.], seq 496:644, ack 1, win 319, length 148
04:42:55.343504 IP 159.203.47.142.22 > 173.206.219.44.54505: Flags [P.], seq 644:680, ack 1, win 319, length 36
04:42:55.343630 IP 159.203.47.142.22 > 173.206.219.44.54505: Flags [P.], seq 680:828, ack 1, win 319, length 148
04:42:55.380231 IP 173.206.219.44.54505 > 159.203.47.142.22: Flags [.], ack 108, win 2096, length 0
04:42:55.380307 IP 159.203.47.142.22 > 173.206.219.44.54505: Flags [P.], seq 828:1968, ack 1, win 319, length 1140
04:42:55.380551 IP 159.203.47.142.22 > 173.206.219.44.54505: Flags [P.], seq 1968:2108, ack 1, win 319, length 140
04:42:55.380637 IP 159.203.47.142.22 > 173.206.219.44.54505: Flags [P.], seq 2108:2144, ack 1, win 319, length 36
04:42:55.380740 IP 159.203.47.142.22 > 173.206.219.44.54505: Flags [P.], seq 2144:2292, ack 1, win 319, length 148
04:42:55.382132 IP 173.206.219.44.54505 > 159.203.47.142.22: Flags [.], ack 252, win 2095, length 0
04:42:55.382166 IP 159.203.47.142.22 > 173.206.219.44.54505: Flags [P.], seq 2292:2880, ack 1, win 319, length 588
04:42:55.382189 IP 173.206.219.44.54505 > 159.203.47.142.22: Flags [.], ack 460, win 2094, length 0
04:42:55.382335 IP 159.203.47.142.22 > 173.206.219.44.54505: Flags [P.], seq 2880:3020, ack 1, win 319, length 140
04:42:55.382440 IP 159.203.47.142.22 > 173.206.219.44.54505: Flags [P.], seq 3020:3056, ack 1, win 319, length 36
04:42:55.382562 IP 159.203.47.142.22 > 173.206.219.44.54505: Flags [P.], seq 3056:3204, ack 1, win 319, length 148
04:42:55.382659 IP 159.203.47.142.22 > 173.206.219.44.54505: Flags [P.], seq 3204:3240, ack 1, win 319, length 36
04:42:55.382822 IP 159.203.47.142.22 > 173.206.219.44.54505: Flags [P.], seq 3240:3380, ack 1, win 319, length 140
04:42:55.382977 IP 159.203.47.142.22 > 173.206.219.44.54505: Flags [P.], seq 3380:3416, ack 1, win 319, length 36
04:42:55.383107 IP 159.203.47.142.22 > 173.206.219.44.54505: Flags [P.], seq 3416:3564, ack 1, win 319, length 148
04:42:55.384118 IP 173.206.219.44.54505 > 159.203.47.142.22: Flags [.], ack 644, win 2093, length 0
04:42:55.384157 IP 159.203.47.142.22 > 173.206.219.44.54505: Flags [P.], seq 3564:4704, ack 1, win 319, length 1140
04:42:55.384186 IP 173.206.219.44.54505 > 159.203.47.142.22: Flags [.], ack 828, win 2093, length 0
04:42:55.384349 IP 159.203.47.142.22 > 173.206.219.44.54505: Flags [P.], seq 4704:4844, ack 1, win 319, length 140
04:42:55.384471 IP 159.203.47.142.22 > 173.206.219.44.54505: Flags [P.], seq 4844:4880, ack 1, win 319, length 36
04:42:55.384599 IP 159.203.47.142.22 > 173.206.219.44.54505: Flags [P.], seq 4880:5036, ack 1, win 319, length 156
04:42:55.384674 IP 159.203.47.142.22 > 173.206.219.44.54505: Flags [P.], seq 5036:5072, ack 1, win 319, length 36
04:42:55.384832 IP 159.203.47.142.22 > 173.206.219.44.54505: Flags [P.], seq 5072:5212, ack 1, win 319, length 140
04:42:55.384918 IP 159.203.47.142.22 > 173.206.219.44.54505: Flags [P.], seq 5212:5248, ack 1, win 319, length 36
04:42:55.385018 IP 159.203.47.142.22 > 173.206.219.44.54505: Flags [P.], seq 5248:5396, ack 1, win 319, length 148
04:42:55.423028 IP 173.206.219.44.54505 > 159.203.47.142.22: Flags [.], ack 2108, win 2098, length 0
04:42:55.423113 IP 159.203.47.142.22 > 173.206.219.44.54505: Flags [P.], seq 5396:6536, ack 1, win 319, length 1140
04:42:55.423143 IP 173.206.219.44.54505 > 159.203.47.142.22: Flags [.], ack 2292, win 2097, length 0
04:42:55.423370 IP 159.203.47.142.22 > 173.206.219.44.54505: Flags [P.], seq 6536:6676, ack 1, win 319, length 140
04:42:55.423465 IP 159.203.47.142.22 > 173.206.219.44.54505: Flags [P.], seq 6676:6712, ack 1, win 319, length 36
04:42:55.423634 IP 159.203.47.142.22 > 173.206.219.44.54505: Flags [P.], seq 6712:6868, ack 1, win 319, length 156
04:42:55.423757 IP 159.203.47.142.22 > 173.206.219.44.54505: Flags [P.], seq 6868:6904, ack 1, win 319, length 36
04:42:55.423895 IP 159.203.47.142.22 > 173.206.219.44.54505: Flags [P.], seq 6904:7044, ack 1, win 319, length 140
04:42:55.423972 IP 159.203.47.142.22 > 173.206.219.44.54505: Flags [P.], seq 7044:7080, ack 1, win 319, length 36
04:42:55.424146 IP 159.203.47.142.22 > 173.206.219.44.54505: Flags [P.], seq 7080:7228, ack 1, win 319, length 148
04:42:55.425254 IP 173.206.219.44.54505 > 159.203.47.142.22: Flags [.], ack 3020, win 2095, length 0
04:42:55.425299 IP 159.203.47.142.22 > 173.206.219.44.54505: Flags [P.], seq 7228:8132, ack 1, win 319, length 904
04:42:55.425324 IP 173.206.219.44.54505 > 159.203.47.142.22: Flags [.], ack 3204, win 2094, length 0
04:42:55.425474 IP 159.203.47.142.22 > 173.206.219.44.54505: Flags [P.], seq 8132:8272, ack 1, win 319, length 140
04:42:55.425614 IP 159.203.47.142.22 > 173.206.219.44.54505: Flags [P.], seq 8272:8524, ack 1, win 319, length 252
04:42:55.425788 IP 159.203.47.142.22 > 173.206.219.44.54505: Flags [P.], seq 8524:8792, ack 1, win 319, length 268
04:42:55.425900 IP 159.203.47.142.22 > 173.206.219.44.54505: Flags [P.], seq 8792:8948, ack 1, win 319, length 156
04:42:55.426008 IP 159.203.47.142.22 > 173.206.219.44.54505: Flags [P.], seq 8948:9104, ack 1, win 319, length 156
04:42:55.426115 IP 159.203.47.142.22 > 173.206.219.44.54505: Flags [P.], seq 9104:9260, ack 1, win 319, length 156
04:42:55.426221 IP 159.203.47.142.22 > 173.206.219.44.54505: Flags [P.], seq 9260:9416, ack 1, win 319, length 156
04:42:55.427403 IP 173.206.219.44.54505 > 159.203.47.142.22: Flags [.], ack 3380, win 2093, length 0
04:42:55.427436 IP 159.203.47.142.22 > 173.206.219.44.54505: Flags [P.], seq 9416:9572, ack 1, win 319, length 156
04:42:55.427455 IP 173.206.219.44.54505 > 159.203.47.142.22: Flags [.], ack 3564, win 2098, length 0
04:42:55.427625 IP 159.203.47.142.22 > 173.206.219.44.54505: Flags [P.], seq 9572:9928, ack 1, win 319, length 356
04:42:55.427740 IP 159.203.47.142.22 > 173.206.219.44.54505: Flags [P.], seq 9928:10084, ack 1, win 319, length 156
04:42:55.427847 IP 159.203.47.142.22 > 173.206.219.44.54505: Flags [P.], seq 10084:10240, ack 1, win 319, length 156
04:42:55.427953 IP 159.203.47.142.22 > 173.206.219.44.54505: Flags [P.], seq 10240:10396, ack 1, win 319, length 156
04:42:55.428061 IP 159.203.47.142.22 > 173.206.219.44.54505: Flags [P.], seq 10396:10552, ack 1, win 319, length 156
04:42:55.428190 IP 159.203.47.142.22 > 173.206.219.44.54505: Flags [P.], seq 10552:10708, ack 1, win 319, length 156
04:42:55.428367 IP 159.203.47.142.22 > 173.206.219.44.54505: Flags [P.], seq 10708:10864, ack 1, win 319, length 156
04:42:55.429377 IP 173.206.219.44.54505 > 159.203.47.142.22: Flags [.], ack 4844, win 2093, length 0
04:42:55.429410 IP 159.203.47.142.22 > 173.206.219.44.54505: Flags [P.], seq 10864:11020, ack 1, win 319, length 156
04:42:55.429434 IP 173.206.219.44.54505 > 159.203.47.142.22: Flags [.], ack 5036, win 2098, length 0
04:42:55.429628 IP 159.203.47.142.22 > 173.206.219.44.54505: Flags [P.], seq 11020:11376, ack 1, win 319, length 356
04:42:55.429770 IP 159.203.47.142.22 > 173.206.219.44.54505: Flags [P.], seq 11376:11532, ack 1, win 319, length 156
04:42:55.429897 IP 159.203.47.142.22 > 173.206.219.44.54505: Flags [P.], seq 11532:11688, ack 1, win 319, length 156
04:42:55.430022 IP 159.203.47.142.22 > 173.206.219.44.54505: Flags [P.], seq 11688:11844, ack 1, win 319, length 156
04:42:55.430149 IP 159.203.47.142.22 > 173.206.219.44.54505: Flags [P.], seq 11844:12000, ack 1, win 319, length 156
04:42:55.430281 IP 159.203.47.142.22 > 173.206.219.44.54505: Flags [P.], seq 12000:12156, ack 1, win 319, length 156
04:42:55.430410 IP 159.203.47.142.22 > 173.206.219.44.54505: Flags [P.], seq 12156:12312, ack 1, win 319, length 156
04:42:55.431403 IP 173.206.219.44.54505 > 159.203.47.142.22: Flags [.], ack 5212, win 2097, length 0
04:42:55.431440 IP 159.203.47.142.22 > 173.206.219.44.54505: Flags [P.], seq 12312:12468, ack 1, win 319, length 156
04:42:55.431461 IP 173.206.219.44.54505 > 159.203.47.142.22: Flags [.], ack 5396, win 2097, length 0
04:42:55.431654 IP 159.203.47.142.22 > 173.206.219.44.54505: Flags [P.], seq 12468:12824, ack 1, win 319, length 356
04:42:55.431794 IP 159.203.47.142.22 > 173.206.219.44.54505: Flags [P.], seq 12824:12980, ack 1, win 319, length 156
04:42:55.431928 IP 159.203.47.142.22 > 173.206.219.44.54505: Flags [P.], seq 12980:13136, ack 1, win 319, length 156
04:42:55.432054 IP 159.203.47.142.22 > 173.206.219.44.54505: Flags [P.], seq 13136:13292, ack 1, win 319, length 156
04:42:55.432179 IP 159.203.47.142.22 > 173.206.219.44.54505: Flags [P.], seq 13292:13448, ack 1, win 319, length 156
04:42:55.432334 IP 159.203.47.142.22 > 173.206.219.44.54505: Flags [P.], seq 13448:13604, ack 1, win 319, length 156
04:42:55.432464 IP 159.203.47.142.22 > 173.206.219.44.54505: Flags [P.], seq 13604:13760, ack 1, win 319, length 156
04:42:55.478785 IP 173.206.219.44.54505 > 159.203.47.142.22: Flags [.], ack 6676, win 2098, length 0
04:42:55.478865 IP 159.203.47.142.22 > 173.206.219.44.54505: Flags [P.], seq 13760:13916, ack 1, win 319, length 156
04:42:55.479151 IP 159.203.47.142.22 > 173.206.219.44.54505: Flags [P.], seq 13916:14176, ack 1, win 319, length 260
04:42:55.479274 IP 159.203.47.142.22 > 173.206.219.44.54505: Flags [P.], seq 14176:14332, ack 1, win 319, length 156
04:42:55.479417 IP 159.203.47.142.22 > 173.206.219.44.54505: Flags [P.], seq 14332:14488, ack 1, win 319, length 156
04:42:55.480721 IP 173.206.219.44.54505 > 159.203.47.142.22: Flags [.], ack 6868, win 2097, length 0
04:42:55.480764 IP 159.203.47.142.22 > 173.206.219.44.54505: Flags [P.], seq 14488:14644, ack 1, win 319, length 156
04:42:55.480992 IP 159.203.47.142.22 > 173.206.219.44.54505: Flags [P.], seq 14644:14904, ack 1, win 319, length 260
04:42:55.481170 IP 159.203.47.142.22 > 173.206.219.44.54505: Flags [P.], seq 14904:15060, ack 1, win 319, length 156
04:42:55.481282 IP 159.203.47.142.22 > 173.206.219.44.54505: Flags [P.], seq 15060:15216, ack 1, win 319, length 156
04:42:55.482643 IP 173.206.219.44.54505 > 159.203.47.142.22: Flags [.], ack 7044, win 2097, length 0
04:42:55.482679 IP 159.203.47.142.22 > 173.206.219.44.54505: Flags [P.], seq 15216:15372, ack 1, win 319, length 156
04:42:55.482705 IP 173.206.219.44.54505 > 159.203.47.142.22: Flags [.], ack 7228, win 2096, length 0
04:42:55.482907 IP 159.203.47.142.22 > 173.206.219.44.54505: Flags [P.], seq 15372:15728, ack 1, win 319, length 356
04:42:55.483031 IP 159.203.47.142.22 > 173.206.219.44.54505: Flags [P.], seq 15728:15884, ack 1, win 319, length 156
04:42:55.483144 IP 159.203.47.142.22 > 173.206.219.44.54505: Flags [P.], seq 15884:16040, ack 1, win 319, length 156
04:42:55.483248 IP 159.203.47.142.22 > 173.206.219.44.54505: Flags [P.], seq 16040:16196, ack 1, win 319, length 156
04:42:55.483350 IP 159.203.47.142.22 > 173.206.219.44.54505: Flags [P.], seq 16196:16352, ack 1, win 319, length 156
04:42:55.483453 IP 159.203.47.142.22 > 173.206.219.44.54505: Flags [P.], seq 16352:16508, ack 1, win 319, length 156
04:42:55.483649 IP 159.203.47.142.22 > 173.206.219.44.54505: Flags [P.], seq 16508:16664, ack 1, win 319, length 156
04:42:55.484639 IP 173.206.219.44.54505 > 159.203.47.142.22: Flags [.], ack 8272, win 2098, length 0
04:42:55.484683 IP 159.203.47.142.22 > 173.206.219.44.54505: Flags [P.], seq 16664:16820, ack 1, win 319, length 156
04:42:55.484708 IP 173.206.219.44.54505 > 159.203.47.142.22: Flags [.], ack 8792, win 2096, length 0
04:42:55.484959 IP 159.203.47.142.22 > 173.206.219.44.54505: Flags [P.], seq 16820:17176, ack 1, win 319, length 356
04:42:55.485098 IP 159.203.47.142.22 > 173.206.219.44.54505: Flags [P.], seq 17176:17332, ack 1, win 319, length 156
04:42:55.485241 IP 159.203.47.142.22 > 173.206.219.44.54505: Flags [P.], seq 17332:17488, ack 1, win 319, length 156
04:42:55.485353 IP 159.203.47.142.22 > 173.206.219.44.54505: Flags [P.], seq 17488:17644, ack 1, win 319, length 156
04:42:55.485457 IP 159.203.47.142.22 > 173.206.219.44.54505: Flags [P.], seq 17644:17800, ack 1, win 319, length 156
04:42:55.485562 IP 159.203.47.142.22 > 173.206.219.44.54505: Flags [P.], seq 17800:17956, ack 1, win 319, length 156
04:42:55.485665 IP 159.203.47.142.22 > 173.206.219.44.54505: Flags [P.], seq 17956:18112, ack 1, win 319, length 156
04:42:55.486797 IP 173.206.219.44.54505 > 159.203.47.142.22: Flags [.], ack 9104, win 2095, length 0
04:42:55.486834 IP 159.203.47.142.22 > 173.206.219.44.54505: Flags [P.], seq 18112:18268, ack 1, win 319, length 156
04:42:55.486858 IP 173.206.219.44.54505 > 159.203.47.142.22: Flags [.], ack 9416, win 2094, length 0
04:42:55.487079 IP 159.203.47.142.22 > 173.206.219.44.54505: Flags [P.], seq 18268:18624, ack 1, win 319, length 356
04:42:55.487226 IP 159.203.47.142.22 > 173.206.219.44.54505: Flags [P.], seq 18624:18780, ack 1, win 319, length 156
04:42:55.487342 IP 159.203.47.142.22 > 173.206.219.44.54505: Flags [P.], seq 18780:18936, ack 1, win 319, length 156
04:42:55.487446 IP 159.203.47.142.22 > 173.206.219.44.54505: Flags [P.], seq 18936:19092, ack 1, win 319, length 156
04:42:55.487549 IP 159.203.47.142.22 > 173.206.219.44.54505: Flags [P.], seq 19092:19248, ack 1, win 319, length 156
04:42:55.487652 IP 159.203.47.142.22 > 173.206.219.44.54505: Flags [P.], seq 19248:19404, ack 1, win 319, length 156
04:42:55.487754 IP 159.203.47.142.22 > 173.206.219.44.54505: Flags [P.], seq 19404:19560, ack 1, win 319, length 156
04:42:55.488813 IP 173.206.219.44.54505 > 159.203.47.142.22: Flags [.], ack 9928, win 2098, length 0
04:42:55.488847 IP 159.203.47.142.22 > 173.206.219.44.54505: Flags [P.], seq 19560:19716, ack 1, win 319, length 156
04:42:55.488869 IP 173.206.219.44.54505 > 159.203.47.142.22: Flags [.], ack 10240, win 2097, length 0
04:42:55.489045 IP 159.203.47.142.22 > 173.206.219.44.54505: Flags [P.], seq 19716:20080, ack 1, win 319, length 364
04:42:55.489208 IP 159.203.47.142.22 > 173.206.219.44.54505: Flags [P.], seq 20080:20236, ack 1, win 319, length 156
04:42:55.489322 IP 159.203.47.142.22 > 173.206.219.44.54505: Flags [P.], seq 20236:20392, ack 1, win 319, length 156
04:42:55.489426 IP 159.203.47.142.22 > 173.206.219.44.54505: Flags [P.], seq 20392:20548, ack 1, win 319, length 156
04:42:55.489529 IP 159.203.47.142.22 > 173.206.219.44.54505: Flags [P.], seq 20548:20704, ack 1, win 319, length 156
04:42:55.489632 IP 159.203.47.142.22 > 173.206.219.44.54505: Flags [P.], seq 20704:20860, ack 1, win 319, length 156
04:42:55.489752 IP 159.203.47.142.22 > 173.206.219.44.54505: Flags [P.], seq 20860:21016, ack 1, win 319, length 156
04:42:55.490720 IP 173.206.219.44.54505 > 159.203.47.142.22: Flags [.], ack 10552, win 2096, length 0
04:42:55.490764 IP 159.203.47.142.22 > 173.206.219.44.54505: Flags [P.], seq 21016:21172, ack 1, win 319, length 156
04:42:55.490793 IP 173.206.219.44.54505 > 159.203.47.142.22: Flags [.], ack 10864, win 2094, length 0
04:42:55.491000 IP 159.203.47.142.22 > 173.206.219.44.54505: Flags [P.], seq 21172:21536, ack 1, win 319, length 364
04:42:55.491148 IP 159.203.47.142.22 > 173.206.219.44.54505: Flags [P.], seq 21536:21692, ack 1, win 319, length 156
04:42:55.491284 IP 159.203.47.142.22 > 173.206.219.44.54505: Flags [P.], seq 21692:21848, ack 1, win 319, length 156
04:42:55.491413 IP 159.203.47.142.22 > 173.206.219.44.54505: Flags [P.], seq 21848:22004, ack 1, win 319, length 156
04:42:55.491542 IP 159.203.47.142.22 > 173.206.219.44.54505: Flags [P.], seq 22004:22160, ack 1, win 319, length 156
04:42:55.491663 IP 159.203.47.142.22 > 173.206.219.44.54505: Flags [P.], seq 22160:22316, ack 1, win 319, length 156
04:42:55.491791 IP 159.203.47.142.22 > 173.206.219.44.54505: Flags [P.], seq 22316:22472, ack 1, win 319, length 156
04:42:55.492986 IP 173.206.219.44.54505 > 159.203.47.142.22: Flags [.], ack 11376, win 2092, length 0
04:42:55.493020 IP 159.203.47.142.22 > 173.206.219.44.54505: Flags [P.], seq 22472:22628, ack 1, win 319, length 156
04:42:55.493041 IP 173.206.219.44.54505 > 159.203.47.142.22: Flags [.], ack 11688, win 2098, length 0
04:42:55.493243 IP 159.203.47.142.22 > 173.206.219.44.54505: Flags [P.], seq 22628:22992, ack 1, win 319, length 364
04:42:55.493370 IP 159.203.47.142.22 > 173.206.219.44.54505: Flags [P.], seq 22992:23148, ack 1, win 319, length 156
04:42:55.493479 IP 159.203.47.142.22 > 173.206.219.44.54505: Flags [P.], seq 23148:23304, ack 1, win 319, length 156
04:42:55.493587 IP 159.203.47.142.22 > 173.206.219.44.54505: Flags [P.], seq 23304:23460, ack 1, win 319, length 156
04:42:55.493692 IP 159.203.47.142.22 > 173.206.219.44.54505: Flags [P.], seq 23460:23616, ack 1, win 319, length 156
04:42:55.493795 IP 159.203.47.142.22 > 173.206.219.44.54505: Flags [P.], seq 23616:23772, ack 1, win 319, length 156
04:42:55.493896 IP 159.203.47.142.22 > 173.206.219.44.54505: Flags [P.], seq 23772:23928, ack 1, win 319, length 156
04:42:55.494953 IP 173.206.219.44.54505 > 159.203.47.142.22: Flags [.], ack 12000, win 2097, length 0
04:42:55.494985 IP 159.203.47.142.22 > 173.206.219.44.54505: Flags [P.], seq 23928:24084, ack 1, win 319, length 156
04:42:55.495005 IP 173.206.219.44.54505 > 159.203.47.142.22: Flags [.], ack 12312, win 2096, length 0
04:42:55.495223 IP 159.203.47.142.22 > 173.206.219.44.54505: Flags [P.], seq 24084:24448, ack 1, win 319, length 364
04:42:55.495343 IP 159.203.47.142.22 > 173.206.219.44.54505: Flags [P.], seq 24448:24604, ack 1, win 319, length 156
04:42:55.495448 IP 159.203.47.142.22 > 173.206.219.44.54505: Flags [P.], seq 24604:24760, ack 1, win 319, length 156
04:42:55.495551 IP 159.203.47.142.22 > 173.206.219.44.54505: Flags [P.], seq 24760:24916, ack 1, win 319, length 156
04:42:55.495654 IP 159.203.47.142.22 > 173.206.219.44.54505: Flags [P.], seq 24916:25072, ack 1, win 319, length 156
04:42:55.495758 IP 159.203.47.142.22 > 173.206.219.44.54505: Flags [P.], seq 25072:25228, ack 1, win 319, length 156
04:42:55.495862 IP 159.203.47.142.22 > 173.206.219.44.54505: Flags [P.], seq 25228:25384, ack 1, win 319, length 156
04:42:55.497165 IP 173.206.219.44.54505 > 159.203.47.142.22: Flags [.], ack 12824, win 2094, length 0
04:42:55.497211 IP 159.203.47.142.22 > 173.206.219.44.54505: Flags [P.], seq 25384:25540, ack 1, win 319, length 156
04:42:55.497243 IP 173.206.219.44.54505 > 159.203.47.142.22: Flags [.], ack 13136, win 2092, length 0
04:42:55.497445 IP 159.203.47.142.22 > 173.206.219.44.54505: Flags [P.], seq 25540:25904, ack 1, win 319, length 364
04:42:55.497573 IP 159.203.47.142.22 > 173.206.219.44.54505: Flags [P.], seq 25904:26060, ack 1, win 319, length 156
04:42:55.497681 IP 159.203.47.142.22 > 173.206.219.44.54505: Flags [P.], seq 26060:26216, ack 1, win 319, length 156
04:42:55.497789 IP 159.203.47.142.22 > 173.206.219.44.54505: Flags [P.], seq 26216:26372, ack 1, win 319, length 156
04:42:55.497892 IP 159.203.47.142.22 > 173.206.219.44.54505: Flags [P.], seq 26372:26528, ack 1, win 319, length 156
04:42:55.497995 IP 159.203.47.142.22 > 173.206.219.44.54505: Flags [P.], seq 26528:26684, ack 1, win 319, length 156
04:42:55.498097 IP 159.203.47.142.22 > 173.206.219.44.54505: Flags [P.], seq 26684:26840, ack 1, win 319, length 156
04:42:55.499152 IP 173.206.219.44.54505 > 159.203.47.142.22: Flags [.], ack 13448, win 2098, length 0
04:42:55.499186 IP 159.203.47.142.22 > 173.206.219.44.54505: Flags [P.], seq 26840:26996, ack 1, win 319, length 156
04:42:55.499207 IP 173.206.219.44.54505 > 159.203.47.142.22: Flags [.], ack 13760, win 2097, length 0
04:42:55.499387 IP 159.203.47.142.22 > 173.206.219.44.54505: Flags [P.], seq 26996:27360, ack 1, win 319, length 364
04:42:55.499545 IP 159.203.47.142.22 > 173.206.219.44.54505: Flags [P.], seq 27360:27516, ack 1, win 319, length 156
04:42:55.499662 IP 159.203.47.142.22 > 173.206.219.44.54505: Flags [P.], seq 27516:27672, ack 1, win 319, length 156
04:42:55.499769 IP 159.203.47.142.22 > 173.206.219.44.54505: Flags [P.], seq 27672:27828, ack 1, win 319, length 156
04:42:55.499873 IP 159.203.47.142.22 > 173.206.219.44.54505: Flags [P.], seq 27828:27984, ack 1, win 319, length 156
04:42:55.499976 IP 159.203.47.142.22 > 173.206.219.44.54505: Flags [P.], seq 27984:28140, ack 1, win 319, length 156
04:42:55.500080 IP 159.203.47.142.22 > 173.206.219.44.54505: Flags [P.], seq 28140:28296, ack 1, win 319, length 156
04:42:55.517697 IP 173.206.219.44.54505 > 159.203.47.142.22: Flags [.], ack 14176, win 2095, length 0
04:42:55.517774 IP 159.203.47.142.22 > 173.206.219.44.54505: Flags [P.], seq 28296:28452, ack 1, win 319, length 156
04:42:55.518055 IP 159.203.47.142.22 > 173.206.219.44.54505: Flags [P.], seq 28452:28712, ack 1, win 319, length 260
04:42:55.518197 IP 159.203.47.142.22 > 173.206.219.44.54505: Flags [P.], seq 28712:28868, ack 1, win 319, length 156
04:42:55.518307 IP 159.203.47.142.22 > 173.206.219.44.54505: Flags [P.], seq 28868:29024, ack 1, win 319, length 156
04:42:55.521566 IP 173.206.219.44.54505 > 159.203.47.142.22: Flags [.], ack 14488, win 2094, length 0
04:42:55.521614 IP 159.203.47.142.22 > 173.206.219.44.54505: Flags [P.], seq 29024:29180, ack 1, win 319, length 156
04:42:55.521795 IP 159.203.47.142.22 > 173.206.219.44.54505: Flags [P.], seq 29180:29440, ack 1, win 319, length 260
04:42:55.521912 IP 159.203.47.142.22 > 173.206.219.44.54505: Flags [P.], seq 29440:29596, ack 1, win 319, length 156
04:42:55.522017 IP 159.203.47.142.22 > 173.206.219.44.54505: Flags [P.], seq 29596:29752, ack 1, win 319, length 156
04:42:55.523541 IP 173.206.219.44.54505 > 159.203.47.142.22: Flags [.], ack 14904, win 2098, length 0
04:42:55.523579 IP 159.203.47.142.22 > 173.206.219.44.54505: Flags [P.], seq 29752:29908, ack 1, win 319, length 156
04:42:55.523606 IP 173.206.219.44.54505 > 159.203.47.142.22: Flags [.], ack 15216, win 2097, length 0
04:42:55.523831 IP 159.203.47.142.22 > 173.206.219.44.54505: Flags [P.], seq 29908:30272, ack 1, win 319, length 364
04:42:55.523955 IP 159.203.47.142.22 > 173.206.219.44.54505: Flags [P.], seq 30272:30428, ack 1, win 319, length 156
04:42:55.524066 IP 159.203.47.142.22 > 173.206.219.44.54505: Flags [P.], seq 30428:30584, ack 1, win 319, length 156
04:42:55.524170 IP 159.203.47.142.22 > 173.206.219.44.54505: Flags [P.], seq 30584:30740, ack 1, win 319, length 156
04:42:55.524273 IP 159.203.47.142.22 > 173.206.219.44.54505: Flags [P.], seq 30740:30896, ack 1, win 319, length 156
04:42:55.524377 IP 159.203.47.142.22 > 173.206.219.44.54505: Flags [P.], seq 30896:31052, ack 1, win 319, length 156
04:42:55.524482 IP 159.203.47.142.22 > 173.206.219.44.54505: Flags [P.], seq 31052:31208, ack 1, win 319, length 156
04:42:55.525551 IP 173.206.219.44.54505 > 159.203.47.142.22: Flags [.], ack 15728, win 2095, length 0
04:42:55.525598 IP 159.203.47.142.22 > 173.206.219.44.54505: Flags [P.], seq 31208:31364, ack 1, win 319, length 156
04:42:55.525630 IP 173.206.219.44.54505 > 159.203.47.142.22: Flags [.], ack 16040, win 2094, length 0
04:42:55.525831 IP 159.203.47.142.22 > 173.206.219.44.54505: Flags [P.], seq 31364:31728, ack 1, win 319, length 364
04:42:55.525962 IP 159.203.47.142.22 > 173.206.219.44.54505: Flags [P.], seq 31728:31884, ack 1, win 319, length 156
04:42:55.526071 IP 159.203.47.142.22 > 173.206.219.44.54505: Flags [P.], seq 31884:32040, ack 1, win 319, length 156
04:42:55.526181 IP 159.203.47.142.22 > 173.206.219.44.54505: Flags [P.], seq 32040:32196, ack 1, win 319, length 156
04:42:55.526285 IP 159.203.47.142.22 > 173.206.219.44.54505: Flags [P.], seq 32196:32352, ack 1, win 319, length 156
04:42:55.526389 IP 159.203.47.142.22 > 173.206.219.44.54505: Flags [P.], seq 32352:32508, ack 1, win 319, length 156
04:42:55.526499 IP 159.203.47.142.22 > 173.206.219.44.54505: Flags [P.], seq 32508:32664, ack 1, win 319, length 156
04:42:55.527991 IP 173.206.219.44.54505 > 159.203.47.142.22: Flags [.], ack 16352, win 2092, length 0
04:42:55.528035 IP 159.203.47.142.22 > 173.206.219.44.54505: Flags [P.], seq 32664:32820, ack 1, win 319, length 156
04:42:55.528062 IP 173.206.219.44.54505 > 159.203.47.142.22: Flags [.], ack 16664, win 2098, length 0
04:42:55.528277 IP 159.203.47.142.22 > 173.206.219.44.54505: Flags [P.], seq 32820:33184, ack 1, win 319, length 364
04:42:55.528402 IP 159.203.47.142.22 > 173.206.219.44.54505: Flags [P.], seq 33184:33340, ack 1, win 319, length 156
04:42:55.528527 IP 159.203.47.142.22 > 173.206.219.44.54505: Flags [P.], seq 33340:33496, ack 1, win 319, length 156
04:42:55.528681 IP 159.203.47.142.22 > 173.206.219.44.54505: Flags [P.], seq 33496:33652, ack 1, win 319, length 156
04:42:55.528795 IP 159.203.47.142.22 > 173.206.219.44.54505: Flags [P.], seq 33652:33808, ack 1, win 319, length 156
04:42:55.528899 IP 159.203.47.142.22 > 173.206.219.44.54505: Flags [P.], seq 33808:33964, ack 1, win 319, length 156
04:42:55.529027 IP 159.203.47.142.22 > 173.206.219.44.54505: Flags [P.], seq 33964:34120, ack 1, win 319, length 156
04:42:55.529968 IP 173.206.219.44.54505 > 159.203.47.142.22: Flags [.], ack 17176, win 2096, length 0
04:42:55.530005 IP 159.203.47.142.22 > 173.206.219.44.54505: Flags [P.], seq 34120:34276, ack 1, win 319, length 156
04:42:55.530030 IP 173.206.219.44.54505 > 159.203.47.142.22: Flags [.], ack 17488, win 2095, length 0
04:42:55.530224 IP 159.203.47.142.22 > 173.206.219.44.54505: Flags [P.], seq 34276:34640, ack 1, win 319, length 364
04:42:55.530354 IP 159.203.47.142.22 > 173.206.219.44.54505: Flags [P.], seq 34640:34796, ack 1, win 319, length 156
04:42:55.530461 IP 159.203.47.142.22 > 173.206.219.44.54505: Flags [P.], seq 34796:34952, ack 1, win 319, length 156
04:42:55.530608 IP 159.203.47.142.22 > 173.206.219.44.54505: Flags [P.], seq 34952:35108, ack 1, win 319, length 156
04:42:55.530788 IP 159.203.47.142.22 > 173.206.219.44.54505: Flags [P.], seq 35108:35264, ack 1, win 319, length 156
04:42:55.530903 IP 159.203.47.142.22 > 173.206.219.44.54505: Flags [P.], seq 35264:35420, ack 1, win 319, length 156
04:42:55.531012 IP 159.203.47.142.22 > 173.206.219.44.54505: Flags [P.], seq 35420:35576, ack 1, win 319, length 156
04:42:55.531914 IP 173.206.219.44.54505 > 159.203.47.142.22: Flags [.], ack 17800, win 2094, length 0
04:42:55.531948 IP 159.203.47.142.22 > 173.206.219.44.54505: Flags [P.], seq 35576:35732, ack 1, win 319, length 156
04:42:55.531970 IP 173.206.219.44.54505 > 159.203.47.142.22: Flags [.], ack 18112, win 2092, length 0
04:42:55.532182 IP 159.203.47.142.22 > 173.206.219.44.54505: Flags [P.], seq 35732:36096, ack 1, win 319, length 364
04:42:55.532350 IP 159.203.47.142.22 > 173.206.219.44.54505: Flags [P.], seq 36096:36252, ack 1, win 319, length 156
04:42:55.532479 IP 159.203.47.142.22 > 173.206.219.44.54505: Flags [P.], seq 36252:36408, ack 1, win 319, length 156
04:42:55.532626 IP 159.203.47.142.22 > 173.206.219.44.54505: Flags [P.], seq 36408:36564, ack 1, win 319, length 156
04:42:55.532777 IP 159.203.47.142.22 > 173.206.219.44.54505: Flags [P.], seq 36564:36720, ack 1, win 319, length 156
04:42:55.532938 IP 159.203.47.142.22 > 173.206.219.44.54505: Flags [P.], seq 36720:36876, ack 1, win 319, length 156
